{
  "schemaVersion": "1.0.0",
  "graphVersion": "1.0.0",
  "status": "DRAFT",
  "locales": ["en", "zh-CN"],
  "domains": [
    {"id":"domain-understand-ai","slug":"understand-ai","order":0,"titleKey":"domains.understand-ai.title","descriptionKey":"domains.understand-ai.description"},
    {"id":"domain-build-ai","slug":"build-ai","order":1,"titleKey":"domains.build-ai.title","descriptionKey":"domains.build-ai.description"},
    {"id":"domain-use-ai","slug":"use-ai","order":2,"titleKey":"domains.use-ai.title","descriptionKey":"domains.use-ai.description"}
  ],
  "branches": [
    {"id":"branch-ai-foundations","domainId":"domain-understand-ai","parentBranchId":null,"slug":"ai-foundations","order":0,"titleKey":"branches.ai-foundations.title","descriptionKey":"branches.ai-foundations.description"},
    {"id":"branch-ai-limits","domainId":"domain-understand-ai","parentBranchId":null,"slug":"ai-limits","order":1,"titleKey":"branches.ai-limits.title","descriptionKey":"branches.ai-limits.description"},
    {"id":"branch-ai-native-software","domainId":"domain-build-ai","parentBranchId":null,"slug":"ai-native-software","order":0,"titleKey":"branches.ai-native-software.title","descriptionKey":"branches.ai-native-software.description"},
    {"id":"branch-vibe-coding","domainId":"domain-build-ai","parentBranchId":"branch-ai-native-software","slug":"vibe-coding","order":0,"titleKey":"branches.vibe-coding.title","descriptionKey":"branches.vibe-coding.description"},
    {"id":"branch-llm-apps","domainId":"domain-build-ai","parentBranchId":"branch-ai-native-software","slug":"llm-apps","order":1,"titleKey":"branches.llm-apps.title","descriptionKey":"branches.llm-apps.description"},
    {"id":"branch-knowledge-systems","domainId":"domain-build-ai","parentBranchId":null,"slug":"knowledge-systems","order":1,"titleKey":"branches.knowledge-systems.title","descriptionKey":"branches.knowledge-systems.description"},
    {"id":"branch-rag","domainId":"domain-build-ai","parentBranchId":"branch-knowledge-systems","slug":"rag","order":0,"titleKey":"branches.rag.title","descriptionKey":"branches.rag.description"},
    {"id":"branch-agents","domainId":"domain-build-ai","parentBranchId":null,"slug":"agents","order":2,"titleKey":"branches.agents.title","descriptionKey":"branches.agents.description"},
    {"id":"branch-agent-runtime","domainId":"domain-build-ai","parentBranchId":"branch-agents","slug":"agent-runtime","order":0,"titleKey":"branches.agent-runtime.title","descriptionKey":"branches.agent-runtime.description"},
    {"id":"branch-production-ai","domainId":"domain-build-ai","parentBranchId":null,"slug":"production-ai","order":3,"titleKey":"branches.production-ai.title","descriptionKey":"branches.production-ai.description"},
    {"id":"branch-eval-reliability","domainId":"domain-build-ai","parentBranchId":"branch-production-ai","slug":"eval-reliability","order":0,"titleKey":"branches.eval-reliability.title","descriptionKey":"branches.eval-reliability.description"},
    {"id":"branch-create-with-ai","domainId":"domain-use-ai","parentBranchId":null,"slug":"create-with-ai","order":0,"titleKey":"branches.create-with-ai.title","descriptionKey":"branches.create-with-ai.description"},
    {"id":"branch-long-form-creation","domainId":"domain-use-ai","parentBranchId":"branch-create-with-ai","slug":"long-form-creation","order":0,"titleKey":"branches.long-form-creation.title","descriptionKey":"branches.long-form-creation.description"},
    {"id":"branch-knowledge-work","domainId":"domain-use-ai","parentBranchId":null,"slug":"knowledge-work","order":1,"titleKey":"branches.knowledge-work.title","descriptionKey":"branches.knowledge-work.description"},
    {"id":"branch-knowledge-base","domainId":"domain-use-ai","parentBranchId":"branch-knowledge-work","slug":"knowledge-base","order":0,"titleKey":"branches.knowledge-base.title","descriptionKey":"branches.knowledge-base.description"}
  ],
  "concepts": [
    {"id":"concept-probabilistic-behavior","kind":"MENTAL_MODEL","primaryBranchId":"branch-ai-foundations","branchIds":["branch-ai-foundations"],"titleKey":"concepts.probabilistic-behavior.title","summaryKey":"concepts.probabilistic-behavior.summary","difficulty":"FOUNDATION","maturity":"PUBLISHED","versionSensitive":false,"sourceRefs":[],"tags":["llm","foundations"],"legacyIds":["S00-M01"]},
    {"id":"concept-model-vs-runtime-fact","kind":"MENTAL_MODEL","primaryBranchId":"branch-ai-limits","branchIds":["branch-ai-limits","branch-llm-apps","branch-eval-reliability"],"titleKey":"concepts.model-vs-runtime-fact.title","summaryKey":"concepts.model-vs-runtime-fact.summary","difficulty":"FOUNDATION","maturity":"PUBLISHED","versionSensitive":false,"sourceRefs":[],"tags":["runtime","reliability"],"legacyIds":["S00-M02"]},
    {"id":"concept-context-management","kind":"PRACTICE","primaryBranchId":"branch-llm-apps","branchIds":["branch-llm-apps","branch-rag","branch-agent-runtime","branch-long-form-creation","branch-knowledge-base"],"titleKey":"concepts.context-management.title","summaryKey":"concepts.context-management.summary","difficulty":"INTERMEDIATE","maturity":"PLANNED","versionSensitive":false,"sourceRefs":[],"tags":["context","workflow"],"legacyIds":["S02-M01"]},
    {"id":"concept-specification-before-generation","kind":"PRACTICE","primaryBranchId":"branch-vibe-coding","branchIds":["branch-vibe-coding","branch-long-form-creation"],"titleKey":"concepts.specification-before-generation.title","summaryKey":"concepts.specification-before-generation.summary","difficulty":"FOUNDATION","maturity":"PLANNED","versionSensitive":false,"sourceRefs":[],"tags":["specification","workflow"],"legacyIds":[]},
    {"id":"concept-ai-code-review","kind":"PRACTICE","primaryBranchId":"branch-vibe-coding","branchIds":["branch-vibe-coding","branch-eval-reliability"],"titleKey":"concepts.ai-code-review.title","summaryKey":"concepts.ai-code-review.summary","difficulty":"INTERMEDIATE","maturity":"PLANNED","versionSensitive":false,"sourceRefs":[],"tags":["coding","review"],"legacyIds":[]},
    {"id":"concept-source-authority","kind":"MENTAL_MODEL","primaryBranchId":"branch-rag","branchIds":["branch-rag","branch-long-form-creation","branch-knowledge-base"],"titleKey":"concepts.source-authority.title","summaryKey":"concepts.source-authority.summary","difficulty":"INTERMEDIATE","maturity":"PUBLISHED","versionSensitive":false,"sourceRefs":[],"tags":["sources","authority"],"legacyIds":["S02-M07"]},
    {"id":"concept-retrieval-pipeline","kind":"SYSTEM_COMPONENT","primaryBranchId":"branch-rag","branchIds":["branch-rag","branch-knowledge-base"],"titleKey":"concepts.retrieval-pipeline.title","summaryKey":"concepts.retrieval-pipeline.summary","difficulty":"INTERMEDIATE","maturity":"PLANNED","versionSensitive":false,"sourceRefs":[],"tags":["rag","retrieval"],"legacyIds":[]},
    {"id":"concept-agent-loop","kind":"SYSTEM_COMPONENT","primaryBranchId":"branch-agent-runtime","branchIds":["branch-agent-runtime"],"titleKey":"concepts.agent-loop.title","summaryKey":"concepts.agent-loop.summary","difficulty":"INTERMEDIATE","maturity":"PUBLISHED","versionSensitive":false,"sourceRefs":[],"tags":["agents","loop"],"legacyIds":["S05-M01"]},
    {"id":"concept-workflow-decomposition","kind":"PRACTICE","primaryBranchId":"branch-agent-runtime","branchIds":["branch-agent-runtime","branch-vibe-coding","branch-long-form-creation"],"titleKey":"concepts.workflow-decomposition.title","summaryKey":"concepts.workflow-decomposition.summary","difficulty":"INTERMEDIATE","maturity":"PLANNED","versionSensitive":false,"sourceRefs":[],"tags":["workflow","agents"],"legacyIds":[]},
    {"id":"concept-timeout-ambiguity","kind":"RISK","primaryBranchId":"branch-eval-reliability","branchIds":["branch-eval-reliability","branch-agent-runtime"],"titleKey":"concepts.timeout-ambiguity.title","summaryKey":"concepts.timeout-ambiguity.summary","difficulty":"INTERMEDIATE","maturity":"PUBLISHED","versionSensitive":false,"sourceRefs":[],"tags":["reliability","timeout"],"legacyIds":["S06-M01"]},
    {"id":"concept-idempotency-boundary","kind":"PATTERN","primaryBranchId":"branch-eval-reliability","branchIds":["branch-eval-reliability","branch-agent-runtime"],"titleKey":"concepts.idempotency-boundary.title","summaryKey":"concepts.idempotency-boundary.summary","difficulty":"INTERMEDIATE","maturity":"PUBLISHED","versionSensitive":false,"sourceRefs":[],"tags":["reliability","side-effects"],"legacyIds":["S06-M03"]},
    {"id":"concept-evaluation-evidence","kind":"MENTAL_MODEL","primaryBranchId":"branch-eval-reliability","branchIds":["branch-eval-reliability","branch-vibe-coding","branch-rag","branch-agent-runtime"],"titleKey":"concepts.evaluation-evidence.title","summaryKey":"concepts.evaluation-evidence.summary","difficulty":"INTERMEDIATE","maturity":"PUBLISHED","versionSensitive":true,"sourceRefs":["anthropic-agent-evals-2026-01-09"],"tags":["evaluation","evidence"],"legacyIds":["S07-M03"]},
    {"id":"concept-long-form-consistency","kind":"RISK","primaryBranchId":"branch-long-form-creation","branchIds":["branch-long-form-creation"],"titleKey":"concepts.long-form-consistency.title","summaryKey":"concepts.long-form-consistency.summary","difficulty":"INTERMEDIATE","maturity":"PLANNED","versionSensitive":false,"sourceRefs":[],"tags":["writing","consistency"],"legacyIds":[]},
    {"id":"concept-knowledge-base-lifecycle","kind":"SYSTEM_COMPONENT","primaryBranchId":"branch-knowledge-base","branchIds":["branch-knowledge-base","branch-rag"],"titleKey":"concepts.knowledge-base-lifecycle.title","summaryKey":"concepts.knowledge-base-lifecycle.summary","difficulty":"INTERMEDIATE","maturity":"PLANNED","versionSensitive":false,"sourceRefs":[],"tags":["knowledge-base","lifecycle"],"legacyIds":[]},